Type,Name,Age,Breed1,Breed2,Gender,Color1,Color2,Color3,MaturitySize,FurLength,Vaccinated,Dewormed,Sterilized,Health,Quantity,Fee,State,RescuerID,VideoAmt,Description,PetID,PhotoAmt,AdoptionSpeed
1,Ding Ding,48,205,0,2,2,5,0,2,2,1,1,2,1,1,0,41326,3b4973ac9e6a430314f5cfd356fdb3e4,0,Ding Ding is adopted. Thanks.,e8d0907ae,5.0,1
2,,3,266,0,2,2,0,0,2,1,2,2,2,1,1,0,41324,e3bbcf8a10e96c7ec63e557a176c9aa0,0,She needs a loving and caring home...,e540c1ba5,1.0,4
2,Bill & Ben,4,266,0,1,1,3,0,1,1,2,1,2,1,2,0,41401,2c711fc92ce10361f5b624d5a9c1e139,0,"Bill and Ben are two adorable rescued male kittens who need a loving home. Both are very clean, very healthy and very playful. It would be nice if they could be adopted together as they enjoy each other's company and play beautifully together, but they can be adopted separately. Both are litter trained and love being held and stroked, they will be very loving pets.",4a4db4d32,1.0,2
2,Almond,9,266,0,2,2,7,0,2,1,2,2,2,1,1,0,41401,e28bf3c810e2b06bc9d5fe56740fdbcd,0,"Almond is an adorable 9 month old female cat with a pretty brown and white coat and a soft and caring nature. She loves nothing more than a rub on her tummy, and we are very sad to give her away! She comes along with Luna, they are sisters and we cannot seperate them. NO CAGING PLEASE. -included: Cat Carrier [good material]",98a98311c,1.0,2
1,Jasz,62,307,0,1,1,3,6,2,2,1,1,1,1,1,0,41401,de218e291145dbc92083d5bc292d10b8,0,Jasz is a very friendly and well-behaved Schnauzer . He doesn’t bark very often so he’s perfect for an apartment. He easily adopts to new places and people.,ef14861df,3.0,4
1,QiQi,36,307,0,2,1,2,0,2,1,1,1,1,1,5,0,41326,2147467fcd35e7a3bc23b9edcffc5702,0,"I rescued QiQi with her sibling (Xiao Bai -) 3 years ago from the flood. She is very healthy, obedient, toilet trained and playful. I hope she can be adopted together with Xiao Bai since they never been separated since puppies and they can find good and loving care new family.",a9bc357f0,1.0,4
1,H3,1,307,307,2,1,2,0,2,2,2,1,2,1,1,0,41326,b53c34474d9e24574bcec6a3d3306a0d,0,Dog 4 Adoption,aaf4a1439,1.0,3
1,Baby / Bubbles,2,141,128,1,1,2,7,1,1,1,3,2,1,1,0,41401,d2ec92fbdbf1e452b57cd25b3d51bc72,0,3 month-old male puppy for adoption. a cross between two pure breeds (Labrador & Jack Russel). Had all his shots/ vaccination.Has tan & black fur. Serious pet lovers only. Looking for a good home for him as we can't keep him. Ty ♥,1e62e6022,5.0,1
1,Ollie,2,307,0,1,1,2,0,1,1,1,1,2,1,1,0,41326,0e18b1cafeff35a2ba291e3c7e31255d,0,"he's rescued from the industrial park. very active. and now way on curing his minor disease (skin problem - ringworm). if the adopter wants it to be spayed, then we will spayed it before handling it over.",4e797dcdd,3.0,4
1,9 Puppies For Adoption!,1,173,96,3,1,2,7,2,2,2,2,2,1,9,100,41335,80ecb2b31b27d310c829d09e1570cef9,0,"I have two litters of puppies for adoption.. Their breed include american pit bull,rottwiler,finnish spitz and lapponian herder.. AMERICAN PIT BULL TERRIER CROSS ROTTWILER PUPPY FOR SALE! Mom pitbull/Dad rottwiler(Both extremely tame) Born /14 Still available for sale 4 males and 1 female. Shows extreme strength just days after born. Shows signs of high alertness(perfect watch dog) Started barking and howling at 9 days old! Started walking and open eyes at 10 days! Started playing and fighting at 15 days. Started solid food at 25 days. Numbering as in the pictures.. (SOLD)1)Color mohogany,male,american pit bull terrier body type and hair,medium sized head with bull dog characteristics. (SOLD)2)Color rottwiler,male,pit bull body type(large)and hair,big sized head with bull dog characteristics. (SOLD)3)Color rottwiler,male,pit bull body type(large)and slightly longer hair,big sized head with bull dog characteristics. (SOLD)4)Color white,male,american pit bull terrier body type and more fluffy hair,small sized head. (SOLD)5)Color white,female,american pit bull terrier body type and hair,small sized head. FINNISH SPITZ CROSS LAPPONIAN HERDER PUPPY FOR SALE! Mom finnish spitz/Dad lapponian herder. Born /14 Still available for sale 3 females and 1 male. Likes to be around people. Shows extreme intelligence. Shows signs of high alertness(perfect watch dog) Started barking and howling at 10 days old! Started walking and open eyes at 12 days! Started playing and fighting at 17 days. Started solid food at 25 days. (AVAILABLE)1)% lapponian herder,female. (SOLD)2)Color finnish spitz(lighter tone),female,very active and likes to glue to people! (SOLD)3)Color finnish spitz(fluffy hair),female. (BOOKED)4)Color finnish spitz,male. Transportation can be provided for outstation buyers but charges will apply. For more info or inquiries pls feel free to contact me..",45d2ddcb8,5.0,2
