Type,Name,Age,Breed1,Breed2,Gender,Color1,Color2,Color3,MaturitySize,FurLength,Vaccinated,Dewormed,Sterilized,Health,Quantity,Fee,State,RescuerID,VideoAmt,Description,PetID,PhotoAmt,AdoptionSpeed
2,Nibble,3,299,0,1,1,7,0,1,1,2,2,2,1,1,100,41326,8480853f516546f6cf33aa88cd76c379,0,Nibble is a 3+ month old ball of cuteness. He is energetic and playful. I rescued a couple of cats a few months ago but could not get them neutered in time as the clinic was fully scheduled. The result was this little kitty. I do not have enough space and funds to care for more cats in my household. Looking for responsible people to take over Nibble's care.,86e1089a3,1.0,2
2,No Name Yet,1,265,0,1,1,2,0,2,2,3,3,3,1,1,0,41401,3082c7125d8fb66f7dd4bff4192c8b14,0,I just found it alone yesterday near my apartment. It was shaking so I had to bring it home to provide temporary care.,6296e909a,2.0,0
1,Brisco,1,307,0,1,2,7,0,2,2,1,1,2,1,1,0,41326,fa90fa5b1ee11c86938398b60abc32cb,0,"Their pregnant mother was dumped by her irresponsible owner at the roadside near some shops in Subang Jaya. Gave birth to them at the roadside. They are all healthy and adorable puppies. Already dewormed, vaccinated and ready to go to a home. No tying or caging for long hours as guard dogs. However, it is acceptable to cage or tie for precautionary purposes. Interested to adopt pls call me.",3422e4906,7.0,3
1,Miko,4,307,0,2,1,2,0,2,1,1,1,2,1,1,150,41401,9238e4f44c71a75282e62f7136c6b240,0,"Good guard dog, very alert, active, obedience waiting for her good master, plz call or sms for more details if you really get interested, thanks!!",5842f1ff5,8.0,2
1,Hunter,1,307,0,1,1,0,0,2,1,2,2,2,1,1,0,41326,95481e953f8aed9ec3d16fc4509537e8,0,"This handsome yet cute boy is up for adoption. He is the most playful pal we've seen in our puppies. He loves to nibble on shoelaces , Chase you at such a young age. Imagine what a cute brat he will be when he grows. We are looking for a loving home for Hunter , one that will take care of him and give him the love that he needs. Please call urgently if you would like to adopt this cutie.",850a43f90,3.0,2
2,,3,266,0,2,5,6,0,2,1,2,2,2,1,1,0,41326,22fe332bf9c924d4718005891c63fbed,0,"This is a stray kitten that came to my house. Have been feeding it, but cannot keep it.",d24c30b4b,2.0,2
2,BULAT,12,264,264,1,1,0,0,2,3,2,2,3,1,1,300,41326,1e0b5a458b5b77f5af581d57ebf570b3,0,anyone within the area of ipoh or taiping who interested to adopt my cat can contact my father at this number (mazuvil)or can just email me. currently bulat is at my hometown at perak but anyone outside the area still want to adopt can travel there to my hometown.there is a lot of cats in my house rite now..i think i should let one of them go to a better owner who can give better attention to him.,1caa6fcdb,3.0,1
1,Siu Pak & Her 6 Puppies,0,307,0,2,1,2,7,2,1,2,2,2,1,6,0,41326,1fba5f6e5480946254590d48f9c5198d,0,Siu Pak just give birth on 13/6/10 to 6puppies. Interested pls call or sms me. Left 2female puppies on 2/7/10,97aa9eeac,9.0,3
2,,2,265,0,2,6,0,0,2,2,2,2,2,1,1,0,41326,d8af7afece71334473575c9f70daf00d,0,"healthy and active, feisty kitten found in neighbours' garden. Not sure of sex.",c06d167ca,6.0,1
2,Kitty,12,265,0,2,1,7,0,2,2,3,3,3,1,1,0,41326,1f3f36e4b18e94855b3e88af0852fdc4,0,"Very manja and gentle stray cat found, we would really like to find a home for it because we cannot keep her for ourselves for long. Has a very cute high pitch but soft meow. Please contact me if you would be interested in adopting.",7a0942d61,2.0,4
1,Bear,2,307,0,1,1,2,7,2,1,2,1,2,1,1,0,41401,9238e4f44c71a75282e62f7136c6b240,0,"For serious adopter, please do sms or call for more details, thanks!",8b693ca84,7.0,1
2,Kali,3,264,0,2,1,2,5,3,3,1,1,2,1,1,50,41326,a9caef3f98e67bfac9093cca79e20b93,0,"Kali is a super playful kitten who is on the go the minute she wakes up. She is very quiet and only meows very rarely. She likes to cuddle when she is sleepy and also when she wakes up from a nap. As long as she has her toys, she keeps herself active and busy during the day. Would recommend you spend at least half an hour every night to play with her as it is her normal routine now. Would recommend that you house her alone as a single cat or with another kitten. She has had her second vaccination and deworming and needs another one next month. Serious adopters only please. Looking for a good forever home for Kali. For more info/photos please whatsapp",8e76c8e39,2.0,1
1,Peanut,2,307,0,1,2,5,6,2,3,1,1,2,1,1,0,41326,db784cbcf321e1d8856b312638b94113,0,Peanut was an abused puppy until he was rescued. He was very scared of people but now he is a very happy and active puppy! He is a really loving puppy now. (: Lester Jenny Will you adopt him? ================================================== Adopters are required to vaccinate and neuter them. ==================================================,aaedd873d,1.0,2
2,2 Mths Old Cute Kitties,2,265,0,3,1,6,7,1,2,2,2,3,1,7,0,41326,2c118b2a1d1b4cf1f735089c7c0a07c0,0,"Hi Pet Lovers! This is my first posting and I need help! 3 months ago we befriended a mother stray cat with 3 kittens in our area and we 'adopted' them but they come and go as they please. 2 months ago the mother gave birth to a litter of 7 cute kittens and we have been taking care of the mother and the kittens ever since in our home...in the ground floor bathroom! Some of the kittens look half-persian with long hair,evident also from the earlier stray batch we adopted. Looking for good caring homes...",4a9793dfb,1.0,1
1,Lost Dog,3,307,0,2,2,5,7,2,2,3,3,3,1,1,0,41401,b609c40c6c840db208b149a19b856f86,0,"Lost Dog Found (Bandar Menjalara, Kepong／Taman Bukit Maluri or Desa Park City) 迷途犬被尋獲 (甲洞孟加拉惹／武吉馬魯里／Desa Park City) Area lost puppy found 小狗被發現地點：Bandar Sri Menjalara, Kepong, KL, Malaysia 大馬吉隆坡甲洞孟加拉惹 How the lost dog found 狗兒如何被發現: The lost puppy entered my staying place itself. 迷途小狗自行進我居住地。 Condition 情況: 雖好像幾天沒進食。看起來健康。頸上系有紅帶。目前甲洞孟加拉惹住宅區保安處看顧。Few days without food. Looks healthy. Neck tied with red belt. Currently taken care by security guard of housing area of Bandar Menjalara.",c02be41e6,2.0,2
1,Max,78,218,205,1,1,7,0,2,2,3,3,3,1,1,0,41326,39112c637c80a6055e8ec544416abffe,0,"We moved out of our apartment to a landed home and there were many friendly strays in the neighbourhood. My grandma's neighbour was moving homes and was looking for a home for their pet.I pleaded with my mom to let us adopt him and he's fun-loving, he plays football and is a great goalie yet a loyal guardog. Now we are moving abroad and Max has no home.",1fd342e17,2.0,4
2,Brownie,6,266,0,2,2,0,0,1,1,1,1,1,1,1,0,41326,58e3aa0b4b78e8879f81774ede0646fe,0,to be spayed on /12 adorable & friendly,b38a74866,1.0,3
1,Blackie,8,307,307,2,2,0,0,2,1,2,1,1,1,1,10,41330,4e3dec1544d1407fce5d65fd0f037e26,0,shes active... she can obey wht command that u told her.. example shakeshand . sleep and eat .. command in english n tamil :).. she will bark if thr suspicius ppl... good for guard act like a male dog..she will sleept in mattres or cradle..whn she eat u can even touch her...we let her because no time to care she... so anyybody intrested to addopt plss call to.. im Mr.Tom..thx petfinder..,f9d07d5fa,2.0,4
1,Beauty,2,307,0,2,1,0,0,2,1,2,1,2,1,1,0,41401,9238e4f44c71a75282e62f7136c6b240,0,"This cutie dumped by it's owner at the market and almost kill by the car, after kicking by the guy, trying to hide herself for safe under the car while the driver is ready to run, ran to her hit on the car to notice the driver stop before i pulled her out and safe her. Luckily the kindness factory guy is allowed me to keep her there, cause my shop is full with 19 dogs and cats, situation not allow me to take in more, due to my work i could only feed her once a day and clean her cage. She's a black beauty, about 2months +, if anyone able to give her a forever home, please do directly contact with me or sms me,thanks! And PLEASE the more i can rehome, the more i can rescue!",1c92ce464,8.0,2
2,,1,266,0,3,1,2,7,1,1,2,2,2,1,5,0,41326,b752f78276215f44581eeb6eea1e63bc,0,"Birth Date: Oct 30th Kitty 1, Melly -Female Sangat comel and vokal. Kitty 2, Tootsie - Male Badan putih, tapi ekor hitam and telinga kekuning-kuningan, macam kucing 3 color. Kitty 3, Bo -Male Corak badan 3 tompok, he is one of the most quite and lightest kitty of the litter tapi jantan. Kitty 4, Michii - Female Macam abang kembar, she is very subtle and sweet, have 1 big spot behind her back and 1 super cute spot belakang telinga. Kitty 5, Missy - Female. She is very curious and adventurous. Very lovable, with sweet voice !",b10e7605a,1.0,4
1,Godiva,12,307,0,2,2,7,0,2,2,2,1,1,1,1,0,41326,a042471e0f43f2cf707104a1a138a7df,0,"Godiva was rescued in Serdang residential area. Her group of friends were caught by dog catcher team and she is the only one left. Being stray, she is not afraid of human touch, she is believed to be fed by some household throughout the period. Godiva looks gorgeous and her unigue colour coats is the eye - catcher. Medium length hair, she is absolutely beautiful and would be a good loving companion. Please do give her a good home.",6436c1a59,7.0,2
1,Tigers,3,307,0,2,6,0,0,2,1,2,1,2,1,3,0,41326,fa7cd6caa034d4332fc75d70807e83a3,0,"Three puppies abandoned on the street, picked up and fed properly.Now active,healthy and cute.",234a5a54c,5.0,4
2,"Kenit, Kenot, Techit, Keyad, Owen",0,114,0,3,3,6,7,2,2,2,2,3,1,10,0,41401,97be67995b53f86f64be212c867009fa,0,"My cats name is Kenit, Kenot,Owen, Keyad, Manja, Techit and 4 Kittens, Baby and family. All my cats are pamper.",1bc0f89d8,0.0,4
1,Donut,10,307,117,2,1,2,7,2,2,1,1,1,1,1,0,41326,aa66486163b6cbc25ea62a34b11c9b91,0,"Donut is a friendly doggie and very domesticated. She will bark at strangers and will not run out of the house. Needs a cage as her sleeping bed, she likes to lie in there. Her former owner abandoned her after she had demodex. She is cured now. Vaccination and neutering fees to be borne by adopter. Please call if you can give her a home.",1bf24d8be,0.0,4
2,Cikenet,3,266,0,1,2,7,0,1,1,2,1,2,1,1,0,41401,b8853c71b981104f1ef126e51387b616,0,"hello cikenets fans, i just wanna inform that cikenet is not lost, i just found out that he is adopted by one of this apartment resident, he become an indoor cat now, he is in good hands and im happy for him..",988988d5b,19.0,1
2,Garfield,36,285,251,1,3,0,0,3,2,1,1,1,1,1,0,41326,001e42763024f9d4abe31e79472b1827,0,"Garfield is a very large cat. Needs daily grooming. He has been groomed short and deflea. Very good wt other cats. Calm cat. He is neutered, vaccinated and dewormed. Must be kept indoors. Needs grooming and brushing as his fur is very soft and thick. If you are interested to adopt Garfield, please give me a call or sent me an email. thank you.",cf7d3eec0,3.0,2
2,No Name,2,285,265,1,3,0,0,2,2,2,2,2,1,1,0,41401,1b9bb5275677d26b00604f24439c81fc,0,healthy toilet trained cute easy to look after playful,85fc3c314,11.0,1
2,No Name,1,266,0,2,1,0,0,2,1,2,2,2,1,1,0,41326,2f846fb8f87a25678374e193559d83c9,0,"Just saved this kitten from the street, but i have too many dogs at home, could not adopt her.",efbf1703a,2.0,2
1,Hunter,14,189,0,1,1,2,0,3,1,1,1,2,1,1,1,41326,cbc97ee98ae458e5deecedbc648e90d2,0,"healthy and active , skinny and tall, as the mother (doberman) fully vaccinated , dewormed. Authorities not allowed have more than 1 dog at home, they dont issue license .",7843a9dca,0.0,3
2,Pepper,1,266,0,2,2,7,0,1,1,2,1,2,1,1,0,41327,86552e2f34c929a01f7841cbd8865b20,0,"This kitten found at the roadside. Stay there and keep meowing. Kitty like to follow human feet. When we stand still, kitty just lean on our feed and sit quietly. Only for indoor adoption. And the adopter must take the kitten to vaccination (start from 2 months old) and neuter (at 6 months old).",d341fbfd6,1.0,2
1,Benji & Kimi,4,205,218,3,2,7,0,1,2,1,1,1,1,2,0,41326,aa66486163b6cbc25ea62a34b11c9b91,0,"Benji and his sister Kimi are a handsome pair of shitzu cross. Both have cute shaggy face, with brown patches over their white body. Very manja and need lots of attention and love. Only as indoor pets and no caging.",1a76190c5,5.0,3
2,Kekok,1,266,0,1,1,0,0,1,1,2,2,2,1,1,0,41361,3cbe8b84e5b4852b5923c348fefcdf31,0,tataO betine ke jantan...ank pd ibu gak,edb920079,1.0,1
1,BoiBoi,24,307,0,1,5,7,0,2,1,1,1,2,1,5,0,41326,2147467fcd35e7a3bc23b9edcffc5702,0,"Boiboi is rescued by my daughter 2 years ago from outside her tuition place. He was sick and abandoned alone without the mother. Now he is very healthy, playful and gentle. He is not only playful but also toilet trained and well behave. I hope he can have new family with full of love and caring.",543130f60,1.0,4
2,,4,266,0,2,1,6,7,1,1,2,2,2,1,2,0,41326,7d58438884ab468dce87c7e252bbd6e4,0,"Two gorgeous kittens have just lost their mummy, and are looking for a loving home. Already on solid food. Potential adopters must be willing to spay, vaccinate, and love them as indoor cats. They've been together since birth, so preference will be given to those willing to welcome both. Existing experience with cats is also a big plus.",9415bc79e,7.0,3
2,Kitten Girl Girl,3,266,0,2,1,7,0,1,1,1,2,2,1,1,1,41327,6e4f4078c85aaa01b4059fbf679e6695,0,Open for adoption!!!,4c6fe4100,5.0,4
2,Tom,12,264,0,2,6,0,0,2,3,2,2,2,1,1,0,41326,76f0a2be251f10691a62e16409b95e47,0,email for more enquiry,0737e4f11,5.0,1
2,,24,265,292,2,1,4,0,2,2,1,1,3,1,3,0,41326,90b00f90ffdf9ec1cac529a2bbef3ecc,0,she fat n healthy. in door cat,61fa73996,2.0,4
2,Comel,2,265,0,2,2,0,0,1,2,2,2,2,1,1,0,41326,b020ad4c866a9f17be0ab3beaa38c78c,0,si comel ini memerlukan seseorang yang boleh menyayangi n menjaganya. she is a lovely cat :) love to be with people :D perlu di adopt dengan segera kerana keadaan sekarang bahaya baginya untuk tinggal di sini.,eabb13cea,3.0,1
1,WHISKY,12,307,0,1,1,0,0,2,1,2,2,2,1,1,0,41336,31de822d0adce3e2dad7dcedfbee2ba8,0,"This is Whisky, rescued from the streets. He is looking for a loving home. He is very friendly and doesn't bark unnecessarily. Gets along quite well with another dog. Please contact me if you wish to adopt him. No caging up or tying up.",deff069a2,4.0,1
1,Boy,12,307,0,1,5,0,0,2,2,1,1,2,1,1,0,41326,6757d0b9d5b72d8b78c20e355c7fe62c,0,-playful -energetic dog -friendly and easily attached to owners -good to be guard and sports companion,4e3640544,1.0,3
2,Angel,2,265,266,2,7,0,0,2,2,2,1,2,1,1,0,41326,3608ac1e44811d7ccba91924b68c8cf5,0,"We temporarily fostered Angel's mother and her three kittens after birth. Angel is born on the 11 March . She is 9 weeks old now. We are looking for a home for Angel. We are looking for working Malaysians or Malaysian families to adopt her. Angel was rather timid and shy when she was a younger kitten but we've seen her blossom in the last few weeks. She is really loving towards her siblings. Note : We put her up for adoption earlier but when the potential adopter failed to turn up, we decided to wait until she is at least two months old and emotionally more ready before putting up for adoption. Please Whatsapp me if you are interested. It is easier for me to keep track of the potential adopter via Whatsapp. I apologise if some of you have contacted me before and I was unable to get back to you. Sometimes it takes more than a week before potential adopters failed to turn up and I would have lost the contacts by then.",ace21b6b1,13.0,3
2,"Drax Aka Fatso, Quill & Rocket",1,266,0,3,1,2,7,1,1,2,2,2,1,3,0,41326,dc161f335e8afdc4b7db7a0d1006450a,0,"3 kittens for adoption, DOB 7 Jun , litter trained & defleas.. very playfull, funny & adorable",8ee223a17,1.0,2
2,Novy,24,292,285,2,7,0,0,2,3,3,3,3,2,6,0,41326,813db17af7694027ab11db3245900c99,0,she is tame siamese persian. she loves to be patted. blue eyed cat. she loves to sleep. she recently got her back leg scratched somewhere.,9a38d4275,1.0,1
1,Jack,5,128,307,1,7,0,0,2,1,1,1,1,1,1,0,41401,ee2747ce26468ec44c7194e7d1d9dad9,0,"Jack is a Jack Russell crossed. He is very friendly, active, playful, and joyful. He has four short legs and a stubby tail.Still it will wags vigourously atwhat delights him.You should see how he & his age gang troop around our garden & terrace.",671ffc570,6.0,3
1,Xiao Gou,12,307,0,1,2,7,0,2,2,2,1,1,1,1,0,41336,61c1f7b917b7f6772c5e77849c2b4127,0,"xiao gou already rescue one year dy,but still not yet get adopter yet....he so sweet n also like to play ....he hv a gf also ,his gf also is rescue after.one.year.dy...they need a.home.....both spay dy...hope can get adopt.one.pair.of.them",aece6e7bf,2.0,4
1,Blackie & Spotty,4,307,0,1,1,7,0,2,1,2,2,2,1,2,0,41326,5788b8639ed178795510a8cbe72ccc28,0,"These 2 adorable male puppies were dumped outside of Mayo Veterinar Clinic, Taipan USJ. They are both active, healthy and up for adoption. Only for responsible adopters who are willing to spay the dogs at special rescue rate of RM only. For adoption, please contact Rani (who works at the vet) at. Address:Mayo Veterinar Clinic, UEP Subang Jaya, 11A, Jalan USJ 10/1g, Subang Jaya, Selangor, Malaysia Tel: +",c1e816568,11.0,4
2,Cimpuk,5,265,0,1,4,7,0,1,3,1,1,2,1,1,0,41326,ce824bb488ae6a8f115a923135d1a642,0,"He was very scared on our way back last night. Couldn't sit still and keep climbing car seat. After reached home, he walked around the house and smelt everything. Just let him familiarize himself with home first. After about 1 hour, I tried to tackle him by playing with him and petting him. He's very cute, active and a heavy sleeper. Love him. Thanks to Cik Amer for letting me adopt him. I'll upload his latest pics soon.",22f6c0ac6,13.0,3
1,Lollipop,72,307,0,2,2,7,0,2,1,1,1,1,1,1,0,41326,c9a898071102b4fc7d485be4ff0e35d9,0,"She is a calm, gentle, good-mannered, friendly,loyal and obedient dog. She was ill-treated by her previous owner. She was sent for a detailed medical examination and to treat some of her wounds, currently still under the vet care. She is eager to shower love to her future owners.",ea159d8da,3.0,4
1,Cute Puppies,1,307,0,3,1,2,0,2,1,3,3,2,1,9,0,41326,fa90fa5b1ee11c86938398b60abc32cb,0,We are cute and good girls and boys. We need a home sweet home. If u are interested to provide us a home. Pls contact ,af1035c81,3.0,3
2,Alang,60,264,0,1,1,2,7,3,3,1,1,1,1,1,0,41326,d835d7d98b94ec261d6d889a39eaed73,0,"Hi... I have one long haired adult male cat for adoption. Please email me for details.. I will have a few questions to ask before I determine who will be a suitable new owner of my beloved baby.. Please, a serious adopter only, who's willing to put heart and soul in caring for him...it's not a simple job :-) If you're just looking for a beautiful long haired kitty, please do not waste ur time emailing me. Thank u very much for ur cooperation. Serious adopters pls email me ",0d25f084f,3.0,2
